user_title,user_year,best_match,similarity,reason
Seal Team Six: The Raid on Osama Bin Laden,2012,Pirates of the Caribbean: On Stranger Tides,0.5060240963855421,Low similarity + metadata check failed
Superpower,2023,Superwho?,0.6666666666666666,Low similarity + metadata check failed
How I Became a Gangster,2019,How I Became a Superhero,0.7659574468085106,Low similarity + metadata check failed
Mariupol: The People's Story,2022,Money Shot: The Pornhub Story,0.5555555555555556,Low similarity + metadata check failed
Memories of CS:GO - The Early Years,2024,Masters of the Air,0.56,Low similarity + metadata check failed
The Witcher: Sirens of the Deep,2025,Mother of the Bride,0.6222222222222222,Low similarity + metadata check failed
